id,created_at,updated_at,description,category_id,price,type_of_post,animal_id,user_id,title,user_position,,,
1203,2019-10-31 15:38:28,2019-10-31 15:38:28,"Sur portée de 5 reste 1 male noir et feu, ne le 19nov19, De Jaia des anges du rempart, DNA, EDO, HD-A, il est puce, vaccine vermifuge et à son Certi (... voir la suite)",1,27,1,200,6798,Chiot berger allemand,Puyravault 85450,,,
1204,2019-05-02 00:06:56,2019-05-02 00:06:56,chiwawas des lys vous presente la belle rubis apparence chihuahua née le 10 octobre 2019 . Elle est vaccinée pucee et vermufigee. Elle est très câl (... voir la suite),1,52,1,1413,3296,Apparence chihuahua a vendre,Non L.O.F.Manchecourt 45300,,,
1205,2019-01-16 08:57:57,2019-01-16 08:57:57,Bonjour a reserver magnifiques bebes d apparence spitz nain Ils sont nés le 2 janvier 2020 et seront disponibles a l'âge légale de huit semaines puc (... voir la suite),1,46,1,1731,6278,Magnifiques bebes d'apparence spitz,Non L.O.F.Yssingeaux 43200,,,
1206,2019-06-12 10:29:31,2019-06-12 10:29:31,"2 bebes persans black Silver et blanc à réserver seront disponibles début avril Très jolis chatons prometteurs Élevés en famille avec amour, ils ser (... voir la suite)",1,22,1,963,5363,A réserver 2 chantons persans,Bagnoles 11600,,,
1207,2019-11-03 03:02:07,2019-11-03 03:02:07,"Encore deux chiots mâle de disponible. un mâle fauve bringé noir et un mâle noir. Ils sont pucés, vaccinés, vermifugés régulièrement. Il vous se (... voir la suite)",1,47,1,700,4487,Chiot lévrier whippet,e Mage 61290,,,
1208,2019-02-12 11:49:44,2019-02-12 11:49:44,La chatterie du crépuscule à le plaisir de vous présenter le dernier chatons d'onlyou à réserver sur une portée de 3 chatons. Ce Burmese américain (... voir la suite),1,39,1,1513,7343,Burmese américain mâle disponible,a Norville 91290,,,
1209,2019-01-13 11:54:12,2019-01-13 11:54:12,"Magnifique portée de 11 chiots Rhodesians ,tout juste vaccinés et pucés ils sont maintenant prêt à l'adoption ,suite désitements 3 superbes femelles (... voir la suite)",1,25,1,1621,5797,Splendide femelles rhodesians,Villars-les-dombes 01330,,,
1210,2019-06-04 00:55:45,2019-06-04 00:55:45,Portée de 5 chiots: Disponible a la Réservation 1 mâle poil long et 2 femelles poil court Père Fred d’Ulmental Ipo1 kkl1 Fils Champion du monde Will (... voir la suite),1,2,1,548,6366,Élevage du tisserand du breuilh,Royères 87400,,,
1211,2019-05-11 00:17:05,2019-05-11 00:17:05,"En Bourgogne 4 Chiots Malamute sont nés le 19 janvier 2020 . Ils sont inscrits au LOF , vermifugés , vaccinés CHPL et identifiés par puce électro (... voir la suite)",1,23,1,308,6718,"En bourgogne , chiots malamute à réserver",Autun 71400,,,
1212,2019-09-13 16:48:45,2019-09-13 16:48:45,L'élevage du Haras des Ifs vend un chiot mâle Labrador chocolat Lof âgé de 3 mois. Ce chiot fait partie de la famille et il très sociable. Nous lui c (... voir la suite),1,42,1,782,4262,Chiot mâle labrador chocolat lof,Saint-wandrille-rançon 76490,,,
1213,2019-09-03 16:06:05,2019-09-03 16:06:05,Disponibles à l'élevage du Harpouy d'Auzan - 2 Magnifiques petits Mâle Cairn Terrier pour Exposition ou Compagnie. Un fauve et un fauve bringé. Magni (... voir la suite),1,45,1,763,4840,2 magnifique mâle cairn terrier,Parleboscq 40310,,,
1214,2019-06-17 03:21:24,2019-06-17 03:21:24,élevage familial hoseki vous propose 2 mâles disponible de suite il s ont vaccinée pucée vermifuge avec passeport européen ainsi qu un certificat vete (... voir la suite),1,30,1,1792,3204,Chiots akita inu,Bussière-dunoise 23320,,,
1215,2019-05-05 09:10:27,2019-05-05 09:10:27,"Disponibles très beaux mâles Schnauzers moyens , nés le 4 août 2019 ( portée de 12 bébés ) , vivent en famille , sociabilisés et issus de parents aux (... voir la suite)",1,5,1,1341,6847,Schnauzers moyens poivre et sel,andivisiau 29400,,,
1216,2019-10-10 17:48:03,2019-10-10 17:48:03,"Naissance le 21 Décembre de 4 bébés, 2 femelles sont disponibles à la réservation. Le bébé sera pucé, vacciné, vermifugé, couleur, comme le bicolor (... voir la suite)",1,46,1,808,2656,Shar-pei femelle,Saint-hilaire-bonneval 87260,,,
1217,2019-12-29 05:23:42,2019-12-29 05:23:42,"Le Clos du Bonheur vous propose des chiots Beagle inscrit au LOF (Pedigree) Portée de Nouska et Never. Nés le 10 Février 2020, 7 beaux bébés tricol (... voir la suite)",1,12,1,814,5096,Chiot beagle lof dispo en avril,Serley 71310,,,
1218,2019-06-19 02:05:05,2019-06-19 02:05:05,À réserver magnifiques chatons British longhair LOOF nés le 1er novembre 2019 La portée est composé d’une femelle bleu et de deux mâles lilas Nos c (... voir la suite),1,11,1,1091,6580,Magnifiques british longhair loof,Créteil 94000,,,
1219,2019-02-27 11:53:45,2019-02-27 11:53:45,4 adorables petits mâles sont venus rejoindre les lutins d'ébène. 3 chiots sont disponibles. Tous mes schipperkes vivent à la maison. Je n'élève que (... voir la suite),1,6,1,1529,7077,Chiots nés au clos des lutins d'ebène,Quenoche 70190,,,
1220,2019-10-20 12:44:58,2019-10-20 12:44:58,"Elevage familial propose à la vente superbes chiots dogue du tibet nés le 23 janvier 2020, issus du mariage de Tseepo Uma Zenjiro du Domaine de Tound (... voir la suite)",1,53,1,149,2294,"Livrés chez vous, splendides bébés dogues du tibet dispo",Charmes 88130,,,
1221,2019-05-09 09:49:13,2019-05-09 09:49:13,"Caniches nains d'un beau gris, élevés en famille avec un excellent caractère. Deux parents visibles. Reste un joli petit mâle de disponible à partir d (... voir la suite)",1,37,1,1951,4421,Jolis caniches nains gris,Bruyères-le-châtel 91680,,,
1222,2019-03-01 12:08:45,2019-03-01 12:08:45,MERCI DE NOUS CONTACTER UNIQUEMENT PAR TELEPHONE AU 06 25 77 31 95 (France) (pas d'email pas de sms merci !) A réserver 1 chiot males LOF BICHON M (... voir la suite),1,1,1,1311,7102,1 chiot mÄle lof bichon maltais,Tulette 26790,,,
1223,2019-07-10 01:47:51,2019-07-10 01:47:51,Magnifiques chatons Maine coon loof disponibles de suite nés le 22 Novembre 2019 issus de hautes origines et d 'un papa polydactyle les parents so (... voir la suite),1,10,1,562,7311,Magnifiques chatons maine coon loof,Souillac 46200,,,
1224,2019-11-19 03:16:44,2019-11-19 03:16:44,MERCI DE NOUS CONTACTER UNIQUEMENT PAR TELEPHONE (pas d'email pas de sms merci !) A vendre 1 chiot mâle LOF coton de tulear né le 24/6/2019 pri (... voir la suite),1,46,1,1958,4444,1 chiot mâle lof coton de tulear 7 mois,Tulette 26790,,,
1225,2019-06-12 06:53:54,2019-06-12 06:53:54,"Elevage familial propose à la vente superbes chiots dogue du tibet nés le 18 janvier 2020, issus du mariage de Tseepo Uma Zenjiro du Domaine de Tound (... voir la suite)",1,23,1,1244,6264,"Livrés chez vous, splendides bébés dogue du tibet dispo",Charmes 88130,,,
1226,2019-11-26 23:46:08,2019-11-26 23:46:08,"3 Portées sont nées début 2020 dans un élevage pro le 24/01/2020, 06/03/2020 et le 03/03/2020 et sont issus de parents vivant au sein de l'élevage. (... voir la suite)",1,52,1,5,5049,Bengal a la réservation,e Luc 83340,,,
1227,2019-05-24 15:43:35,2019-05-24 15:43:35,"Nous avons encore des chiots Terrier Noir Russe disponibles. Les chiots sont nés et grandissent à la maison. Ils seront vermifugé à 2, 4, 6, 8 semain (... voir la suite)",1,4,1,1917,5609,Chiots terrier noir russe disponibles à la réservation,Sarrogna 39270,,,
1228,2019-12-16 15:16:51,2019-12-16 15:16:51,"Naissances jack russell LOF nés le 28 février /chiots dispo début mai, vaccinés, identification électronique, passeport européen, documentation + couv (... voir la suite)",1,59,1,526,4441,"Chiots jack russell lof, à réserver",uarville 28150,,,
1229,2019-04-14 05:34:54,2019-04-14 05:34:54,Disponibles immédiatement : 2 portées de magnifiques chiots Malinois LOF mâles et femelles issus de très bonnes lignées de travail. Père , L'Tex de l (... voir la suite),1,53,1,539,6166,Chiots malinois lof mâles et femelles,Yffiniac 22120,,
1230,2019-06-18 23:17:30,2019-06-18 23:17:30,Une magnifique portée de Coton de Tulear LOF est née en ce début d'année. 4 petites boules de poils ont pointé le bout de leur museau.... 2 femelles (... voir la suite),1,12,1,1992,5767,Coton de tulear lof,Saint-andré-le-gaz 38490,,,
1231,2019-09-11 13:19:49,2019-09-11 13:19:49,"Chiots Braque de Weimar LOF . Parents visibles. Né le 22 Janvier 2020 Disponibles 2 Mâles Nos chiots seront vaccinés, pucés, vermifugés et pa (... voir la suite)",1,17,1,1512,6939,Chiots braque de weimar lof,Mallemort 13370,,,
1232,2019-04-16 04:09:51,2019-04-16 04:09:51,Nos 5 chatons ont vu le jour dans notre appartement le 22 novembre 2019 et ils seront bientôt prêts à partir dans leur nouvelle famille. Ils sont nés (... voir la suite),1,35,1,1559,7314,3 chatons selkirk rex pl crème yx oranges,yon 69002,,,
1233,2019-04-20 20:12:58,2019-04-20 20:12:58,A réserver 3 chiots LOF BICHON HAVANAIS nés le 08/1/2020 prix : 1 000 € 1 male noir et blanc 1 femelle sable 1 femelle noire il seront cédés v (... voir la suite),1,15,1,1349,6373,3 chiots lof bichon havanais,Tulette 26790,,,
1234,2019-02-07 06:06:37,2019-02-07 06:06:37,MERCI DE NOUS CONTACTER UNIQUEMENT PAR TELEPHONE AU 06 25 77 31 95 (pas d'email pas de sms merci !) A vendre 1 chiot male LOF YORKSHIRE né le 29/ (... voir la suite),1,40,1,645,6418,1 chiot mâle lof yorkshire terrier,Tulette 26790,,,
1235,2019-09-16 03:26:14,2019-09-16 03:26:14,nous avons plus que un garçon disponible à la réservation il partira dans sa nouvelle famille vers l age de 4 mois pucée vaccinée rappel fait cast (... voir la suite),1,44,1,21,2714,Chaton munchkin loof,Saint-cyr-sur-loire 37540,,,
1236,2019-12-27 18:29:18,2019-12-27 18:29:18,"Superbe chiot Epagneul Tibétain né le 01-10-19 couleur fauve Superbes origines, excellent caractère Nos chiots sont élevés dans un contexte famili (... voir la suite)",1,53,1,121,4117,Epagneul tibétain lof,Pont-audemer 27500,,,
1237,2019-03-22 14:16:46,2019-03-22 14:16:46,"Jiro ichiro go akita no hasuhana ,pedigree sur demande, est LOF et confirmé, issue d'une des plus prestigieuse lignée d'akita inu, les seigneurs d'ori (... voir la suite)",1,35,1,1491,6912,Saillie akita-inu lof - confirmé - prestigieuses origines,Pollestres 66450,,,
1238,2019-03-09 19:05:24,2019-03-09 19:05:24,"Bonjour, Je propose mon mâle ragdoll seal bicolore pour saillie. Il est extrêmement gentil avec les femelles. Primé en exposition Champion Te (... voir la suite)",1,36,1,1092,7079,Mâle ragdoll pour saillie,e Barp 33114,,,
1239,2019-02-14 00:44:00,2019-02-14 00:44:00,"Les bébés de Bouboule et Stan sont nés le 14 octobre. Première portée de Bouboule ( New Soul Natural Mystic), c'est aussi le première fois que Will ( (... voir la suite)",1,48,1,859,5214,Les bébé de jamming et will,Vicq-sur-gartempe 86260,,,
1240,2019-09-22 02:24:00,2019-09-22 02:24:00,Vends westie Males 1100€ Vaccinés identifiés par une puce électronique inscrits au lof. Disponibles fin avril 2020 Parents visibles tous les 2 (... voir la suite),1,39,1,729,5059,Westie lof,es Rues-des-vignes 59258,,,
1241,2019-03-21 09:44:04,2019-03-21 09:44:04,"Perli-Popette de Maison-Tricorne, née le 23 décembre, est une très jolie petite exotic shorthair de couleur seal tortie lynx point. Elle a un pedigree (... voir la suite)",1,35,1,1946,2028,Très belle exotic colourpoint,Taninges 74440,,,
1242,2019-01-23 02:41:06,2019-01-23 02:41:06,"Notre Ginger dite 'Baby' femelle bengal, retraitée depuis 4 ans, âgée de 8 ans, ne supporte plus la vie avec les autres chats, nous lui cherchons don (... voir la suite)",1,59,1,521,5954,Adulte femelle bengal,Combs-la-ville 77380,,,
1243,2019-08-05 06:09:12,2019-08-05 06:09:12,Jolis chiots pucés vaccinés lof queue écourtée visibles en Normandie dépt 61 : Jack Russell terrier & Parson Russell terrier - mâles : tricolore (... voir la suite),1,36,1,830,2577,"Chiots parson russell terrier lof , mâles",Gâprée 61390,,,
1244,2019-08-25 09:36:22,2019-08-25 09:36:22,Jolis chiots pucés vaccinés lof queue écourtée visibles en Normandie dépt 61 : Jack Russell terrier & Parson Russell terrier - mâles : tricolore (... voir la suite),1,22,1,55,7107,"Chiots jack russell / parson russell terrier lof , mâles et femelle",Gâprée 61390,,,
1245,2019-12-22 07:59:06,2019-12-22 07:59:06,chiots komondor nés le 24 01 2020 eleves en famille vendu avec toutes les garanties légales suivi d'élevage a votre disposition pour tout rense (... voir la suite),1,28,1,1944,5840,Chiots à reserver,Rousson 30340,,,
1246,2019-03-17 12:07:02,2019-03-17 12:07:02,"L 'élevage du Haras des Ifs vend 5 bébés Labrador chocolats LOF nés le 28 Déc. Ils seront donc disponibles à partir 28 février, vaccinés et identifiés (... voir la suite)",1,22,1,1,7854,Chiots labrador chocolats lof,Saint-wandrille-rançon 76490,,,
1247,2019-05-16 02:25:48,2019-05-16 02:25:48,"Disponible : 1 femelle houppette de couleur Bronze tout petit gabarit Pelipa est - Primo-vaccinée + Carnet de santé, - Identifiée par puce + ca (... voir la suite)",1,8,1,934,7040,Disponible chien chinois houppette,Bollène 84500,,,
1248,2019-11-18 02:07:00,2019-11-18 02:07:00,a réserver de superbes chiots labrador sable nés le 15/01/2020 inscrit lof issus d'un élevage familiale seront vaccinés et identifier les parents (... voir la suite),1,14,1,1898,2311,A réserver chiots labrador sable,Evette-salbert 90350,,,
1249,2019-03-10 23:38:04,2019-03-10 23:38:04,Vends femelle Jack Russel LOF et confirmée née le 16.11.2014 identifiée 142MAT vaccin + vermifuges à jour Pour compagnie ou chasse Chienne sociabl (... voir la suite),1,20,1,1112,2932,Jack russel femelle adulte lof,Saint-germain-du-pinel 35370,,,
1250,2019-04-03 04:16:05,2019-04-03 04:16:05,Magnifiques Bébés maines Coons hyper Câlins viventavec chiens et chats ils feront votre bonheur avec leurs continuels ronrons Mâles et femell (... voir la suite),1,48,1,1173,6514,Magnifique petite maine coon loof,Montry 77450,,,
1251,2019-03-30 20:16:34,2019-03-30 20:16:34,"De l'union de Louane , 250268731539323 , N° LOF : 51151/7648 et de Logan , 250268731422908 ? N° LOF : 50759/5662 , 4 mâles ( 2 sont réservés ) et 3 fe (... voir la suite)",1,3,1,642,6653,Chiots cairn-terrier pure race,Bannalec 29380,,,
1252,2019-05-31 01:20:49,2019-05-31 01:20:49,Chatons ( d’apparence exotic shorthair ) non Loof Déclaration pas encore faite Ils seront pucés et vaccinés rcp à la vente Vermifuger régulièreme (... voir la suite),1,22,1,755,5024,D’apparence exotic shorthair,Non L.O.O.F.Dourdain 35450,,,
1253,2019-08-12 17:49:16,2019-08-12 17:49:16,Disponible de suite RASPOUTINE mâle + ou - 3 kg adulte - 750 € tendre très sage élevs en maison habitué au chats - bas sur pattes gabarit dans le st (... voir la suite),1,50,1,50,2638,Chiot non lof apparence mini yorkshire terrier mâle,Non L.O.F.Pruines 12320,,,
1254,2019-10-29 14:41:17,2019-10-29 14:41:17,a vendre 2 superbe chatons mâles red blotched tabby et blanc 1 très jolie femelle Brown blotchet tortie tabby et blanc les parents sont testés (... voir la suite),1,48,1,198,2797,Vente chatons maine coon,Noisy-le-grand 93160,,,
1255,2019-01-10 08:07:46,2019-01-10 08:07:46,"Un merveilleux chaton sacré de Birmanie, de couleur chocolat point est disponibles à l'adoption à la chatterie des sages gardiens. Vaccinés et muni (... voir la suite)",1,20,1,1494,4824,Chaton sacré de birmanie,Marignane 13700,,,
1256,2019-06-10 22:15:47,2019-06-10 22:15:47,"Adorable petite femelle black tortie et blanc, douce, câline, joueuse, recherche une gentille famille. Elle est habituée au toilettage, aux soins des (... voir la suite)",1,18,1,989,2123,Jeune persanne née le 22 juillet 2019,Challans 85300,,,
1257,2019-07-15 02:31:47,2019-07-15 02:31:47,"Qooky, adorable persan noir et blanc né le 22 juillet 2019, d'une portée de 3 chatons, recherche une gentille maison pour couler des jours heureux, ou (... voir la suite)",1,29,1,1925,5572,Jeune chaton persan mâle noir et blanc,Challans 85300,,,
1259,2019-05-17 17:49:35,2019-05-17 17:49:35,"Bonjour, je met en vente 1 femelle husky de Sibérie LOF nommée Phoebee Elle est née le 11.08.2019 elle est LOF. De couleur beige panachure noir et b (... voir la suite)",1,22,1,1906,5956,Chiots husky de siberie lof,Raimbeaucourt 59283,,,
1260,2019-07-14 22:42:19,2019-07-14 22:42:19,Rare chiot beauceron femelle couleur bleue... (... voir la suite),1,52,1,127,5036,Izan eta iraun,Sainte-marie 32200,,,
1261,2019-10-27 03:13:06,2019-10-27 03:13:06,"A l'élevage familial du Souvenir d'Ombelle, issue de chiens de lignée beauté, 6 males dont 2 sables et 2 femelles dont une fauve et une sable attenden (... voir la suite)",1,55,1,1897,7396,1° naissance à l'élévage passion de chiots sables et fauves,Castres 81100,,,
1262,2019-11-29 01:19:59,2019-11-29 01:19:59,Etalon Labrador Sable disponible pour saillie : Homega du Puits de Chanteins (250269500550767) né le 25/09/2012. Champion de Croatie - ETALON RECOMMA (... voir la suite),1,44,1,778,7454,Ch. homega du puits de chanteins - cotation 4,Sérignac 82500,,,
1263,2019-03-13 20:20:34,2019-03-13 20:20:34,La chatterie coon St Phil 45's est une chatterie familiale passionnée et déclarée situé dans le loiret (45) Disponible Passion femelle brown blotch (... voir la suite),1,29,1,85,6693,Chaton femelle maine coon loof,Villorceau 45190,,,
1264,2019-10-16 13:03:23,2019-10-16 13:03:23,"La chatterie DREAM OF IDYLLE a vu la naissance le 28 novembre dernier de 4 bébés British Shorthair couleur bleu, un mâle et trois femelles. Ils poss (... voir la suite)",1,22,1,396,3200,Chatons british,Saint-loubès 33450,,,
1265,2019-08-22 13:23:22,2019-08-22 13:23:22,"Magnifiques chiots berger belge malinois, lignée 100% utilisation. Chiots inscrits au Lof, Pucés, Vaccinés, Vermifugés, Titulaire d’un certificat (... voir la suite)",1,43,1,1566,2100,Chiots berger belge malinois mâle,Saint-benoît-la-forêt 37500,,,
1266,2019-08-01 00:47:41,2019-08-01 00:47:41,"Chienne shiba inu, retraitée d'élevage, née en juin 2012, à céder contre bons soins. pour tout renseignements : Tel 06.82.35.89.79 (... voir la suite)",1,42,1,1116,7118,A ceder pour retraite,Etainhus 76430,,,
1267,2019-05-25 16:08:12,2019-05-25 16:08:12,chiot jack dispo a partir de huit semaines reste au 23 01 20 1 mâle et une femelle photo une le mâle origines sur notre site l antre des jacks pri (... voir la suite),1,56,1,815,7978,A reserver chiot jack russell terrier,Saint-marcel-de-félines 42122,,,
1268,2019-03-24 21:28:59,2019-03-24 21:28:59,"L'Elevage du PARC des ACACIAS Vous propose 12 super BB MALINOIS au LOF , nés le 07 Janvier 2020 (10 mâles+ 2 femelles) ils seront disponibles (... voir la suite)",1,6,1,747,7507,Super bb malinois au lof,Passy-en-valois 02470,,,
1269,2019-03-24 08:47:14,2019-03-24 08:47:14,"Réduction d’élevage. Vends reproducteur bouledogue français bringé LOF. Damon a de très belles origines(Chypre), il est coté 4 pts, identifié génétiq (... voir la suite)",1,32,1,1199,6191,Reproducteur bouledogue français bringé lof,Montaigu-de-quercy 82150,,,
1270,2019-04-27 03:45:26,2019-04-27 03:45:26,LES SEIGNEURS DE LA VALLÉE DE L'ISLE élevage de sélection au cœur du Périgord propose d'adorables chiots SPITZ ALLEMANDS NAINS uniquement LOF . 1 (... voir la suite),1,45,1,352,7129,Superbes pomeranian lof,Veyrines-de-vergt 24380,,,
1271,2019-08-24 08:10:53,2019-08-24 08:10:53,"L’élevage du Tsarcoon vous propose 5 superbes chatons Maine Coon nées le 5/10/2019, 2 garçons (dont un blancs aux yeux bleus et un roux et blanc bicol (... voir la suite)",1,24,1,1620,5088,Magnifiques chatons maine coon loof,Antibes 06600,,,
1272,2019-03-31 10:54:00,2019-03-31 10:54:00,"Pimprenelle est black silver tortie, elle est très câline et aime être toujours pas trop loin de nous. Elle est très sociable et aime à nous raconter (... voir la suite)",1,1,1,54,2530,Chaton femelle maine conn,Plaissan 34230,,,
1273,2019-10-09 02:23:23,2019-10-09 02:23:23,"Paint, Pablo et Picasso attendent leur famille pour une belle vie pleine de câlins et de ronrons. Ils sont vaccinés identifiés stérilisés vermifugés e (... voir la suite)",1,22,1,1290,5623,Chatons mâles sphynx,Plaissan 34230,,,
1274,2019-04-18 15:40:05,2019-04-18 15:40:05,happy mâle border terrier dispo pour saillie plusieurs excellent en expo plus tan prix de la saillie 400 euros (... voir la suite),1,5,1,1044,5951,Dispo pour saillie,Saint-marcel-de-félines 42122,,,
1275,2019-04-05 12:06:14,2019-04-05 12:06:14,"Elevage professionnel vend superbes chatons poils longs ou courts, uniquement LOOF, vaccinés, pucés (Plus d'infos et de photos sur notre site princ (... voir la suite)",1,1,1,245,4944,Magnifique chaton scottish loof,Saint-blaise 74350,,,
1276,2019-05-29 08:52:43,2019-05-29 08:52:43,"Chiots chihuahua nés le 30 Octobre. Ils sont disponible. Pour plus d'infos sur le pedigree, ou des photos 0562597673 ou par mail Ils sont vendus puc (... voir la suite)",1,38,1,283,3652,Chiots chihuahua lof blanc ou noir,oubersan 32300,,,
1277,2019-07-14 08:20:42,2019-07-14 08:20:42,Disponible de suite1 femelle Spitz allemand naine sable charbonné Princesse de l'ange aux papillons elle est née le 15 novembre 2019 Maman,Idoll pri (... voir la suite),1,39,1,619,2346,Chiot femelle spitz naine sable charbonné lof,Crespinet 81350,,
1278,2019-04-12 09:32:44,2019-04-12 09:32:44,Reste sur une portée de 4 chiots : 2 femelle Bullmastiff de couleur fauve clair née le 14/11/2019 Pucee et vaccinée Belles lignées : Maman : m (... voir la suite),1,11,1,1361,5279,Disponible superbes chiots bullmastiff,Neau 53150,,,
1279,2019-07-31 01:41:21,2019-07-31 01:41:21,"Pearl et Penny de Lou Simbèo mère Gini de lou Simbèo père Just Me de lou Simbèo très belles femelles bien carrées , avec une tê (... voir la suite)",1,13,1,105,3396,2 magnifiques femelles,Saintes-maries-de-la-mer 13460,,,
1280,2019-04-25 10:51:07,2019-04-25 10:51:07,"Power et Pepper de lou Simbèo deux jolis mâles mais qui ne sont pas minis ils sont bien carré , une belle tête des oreilles (... voir la suite)",1,46,1,136,3083,Magnifiques mâles standard,Saintes-maries-de-la-mer 13460,,,
1281,2019-08-16 00:24:03,2019-08-16 00:24:03,"Disponible vers le 20/02 1 mâle chihuahua poil court née le 06/12/2019 prix : 1400€ Pucé, vacciné et inscrit au LOF. Magnifique petit mâle bl (... voir la suite)",1,2,1,549,7711,Chihuahua poil court lof,Saint-chef 38890,,,
1282,2019-07-11 14:35:20,2019-07-11 14:35:20,"Disponible vers le 01/04/2020 : 1 mâle chihuahua poil long , couleur rare : lavande Nés le 30/01/2020 Pucé, vacciné et inscrit au LOF. - Mâle (... voir la suite)",1,31,1,1038,4974,Chihuahua poil long lof,Saint-chef 38890,,,
1283,2019-04-26 22:40:27,2019-04-26 22:40:27,"des chiots disponibles, plus de renseignement et photo sur notre site mâle : 900 € - 1000 € femelle des mâles et femelles disponibles braques de we (... voir la suite)",1,37,1,725,4470,Braque de weimar,Saint-vitte 18360,,,
1284,2019-07-22 07:13:47,2019-07-22 07:13:47,"1 mâle disponible, plus de renseignement et photo sur notre site mâle : 900 € des mâles et femelles disponibles braques de weimar entièrement vacci (... voir la suite)",1,58,1,1174,7576,Braque de weimar,Saint-vitte 18360,,,
1285,2019-10-09 12:02:26,2019-10-09 12:02:26,"Disponible pour saillie très beau mâle teckel standard chocolat et feu, LOF. Très bon chasseur, sociable, primé en exposition de Beauté et dans les ép (... voir la suite)",1,19,1,254,7815,Mâle teckel standard poil ras pour saillie,e Syndicat 88120,,,
1286,2019-05-10 12:13:21,2019-05-10 12:13:21,"SÁBA IGOR Très bel Étalon Chocolat Point , Champion , Best of Best toutes races confondues , Best Variété . C’est un vrai gentleman il sera prendre s (... voir la suite)",1,51,1,89,7337,Bel Étalon chocolat point,e Rouret 06650,,,
1287,2019-02-13 01:39:14,2019-02-13 01:39:14,"Meiko, magnifique ragdoll bicolore blue, déjà pourvu d'une nombreuse descendance, est disponible pour saillie. C'est un chat très doux, avec les humai (... voir la suite)",1,20,1,29,5468,Un très beau père,ille 59000,,,
1288,2019-03-09 14:09:19,2019-03-09 14:09:19,"Disponible une petite femelle bleue merle LOF nées le 14 Janvier 2020,sera disponible à partir du 10 Mars 2020. De parents LOF et confirmé, sociable (... voir la suite)",1,38,1,95,5585,Berger des shetlands,rthez 64300,,,
1289,2019-11-16 14:27:07,2019-11-16 14:27:07,"Pitch And Putt : mâle de trois mois, de couleur Seal mink. (Noir aux yeux bleus-verts) Pitch And Putt est vendu pour la compagnie cela signifie qu’ (... voir la suite)",1,47,1,313,4611,Chaton sphynx,Eschentzwiller 68440,,,
1290,2019-11-20 13:29:13,2019-11-20 13:29:13,Bonjour je propose mon Spitz pomeranien en saillie 20 cm au garrot 1 kg 900 extrêmement bien typés mon chien n'est pas à vendre il est uniquement posé (... voir la suite),1,30,1,251,3867,Spitz nain pomeranien en saillie,a Salvetat-saint-gilles 31880,,,
1291,2019-12-22 02:54:12,2019-12-22 02:54:12,"Elevage passionné et spécialisé exclusivement dans le berger belge depuis 15 ans. Nous vous proposons nos chiots Tervueren, lignée utilisation, iss (... voir la suite)",1,41,1,1713,4513,Chiots berger belge tervueren lof,Cernoy-en-berry 45360,,,
1292,2019-03-16 23:20:04,2019-03-16 23:20:04,Teckel nain poil ras ou kaninchen lof vaccines identifies fauves charbonnes disponibles au 23 janvier 2020 (... voir la suite),1,42,1,542,4879,Chiots teckels nains poil ras,Diefmatten 68780,,,
1293,2019-03-06 02:15:37,2019-03-06 02:15:37,"3 trés beaux chatons qui seront disponibles dès début Mars. Ils partent non stérilisés, inscrits LOOF, sevrés, primo-vaccinés, identifiés I-Cad, avec (... voir la suite)",1,54,1,537,5495,Magnifique portée de chatons maine coon loof bleu,Saint-marceau 08160,,,
