id,created_at,updated_at,description,category_id,price,type_of_post,animal_id,user_id,title,user_position,,,
840,2019-02-14 07:16:12,2019-02-14 07:16:12,Elevage Des Gladiateurs de la nuit Vous présente une superbe portée de bouledogue français de Nora Des Gladiateurs de la Nuit et de Mac Los White A (... voir la suite),1,12,1,1786,5670,Disponible de suite,Saint-flovier 37600,,,
841,2019-01-30 17:49:02,2019-01-30 17:49:02,Disponibles à la réservation !! Chatons Persan loof nés le 06/02/2020 1 femelle blue tortie tabby PERSAN 1 femelle brown tortie tabb (... voir la suite),1,32,1,1903,7004,Chaton persan & exotic shorthair loof,Cauffry 60290,,,
842,2019-10-23 23:12:07,2019-10-23 23:12:07,PATCHOULI est disponible de suite pour bonne famille. C'est un magnifique chaton bleu et blanc avec une tres belle fourrure. Il est calme et joueur. (... voir la suite),1,6,1,114,7872,Jeune male highland fold loof,ouqueure 16140,,,
843,2019-10-23 20:37:13,2019-10-23 20:37:13,"Pacha est disponible de suite pour bonne famille, c'est un adorable grand chaton brown tabby et blanc tres tres calin. Il a une magnifique fourrure. (... voir la suite)",1,28,1,250,2775,Adorable mâle highland straight loof,ouqueure 16140,,,
844,2019-08-17 07:55:57,2019-08-17 07:55:57,Élevage familial et passionné propose A réserver chiots carlin lof Ne le 07.02.20 sevrer début avril Il ya 4 femelle et un mâle robe sable Photos (... voir la suite),1,36,1,496,7981,Chiots carlin lof,Pleyber-christ 29410,,,
845,2019-10-08 20:15:32,2019-10-08 20:15:32,A réserver chiots yorkshire Très bonnes origines champion Père pedigree prestige photo 1 ne 26/01/20 Père 1.6kg mère 2.8kg Avec le poil très long (... voir la suite),1,17,1,653,2384,Chiots yorkshire toy lof,Pleyber-christ 29410,,,
846,2019-05-15 13:07:16,2019-05-15 13:07:16,"Disponible de suite 3 chiots berger allemand poil court une femelle et 2 mâles. Ils sont pucés, vaccinés et vermifugés. Issue de lignés beauté et tra (... voir la suite)",1,48,1,243,3951,Chiots berger allemand lof,Vaupillon 28240,,,
847,2019-02-16 23:53:38,2019-02-16 23:53:38,"A réserver adorable chatons siamois nés le 20 janvier 2020. Disponible à partir de début mai 2020 Elevage familiale chatons sociabilisé , élevé e (... voir la suite)",1,50,1,1466,4282,Bébés siamois et orientaux nés le 26 janvier 2020,ongny-au-perche 61290,,,
848,2019-05-27 07:22:08,2019-05-27 07:22:08,"Lépi de Guirons et Milton du Pont Douilly vous annoncent la naissance d'une magnifique portée de 3 chatons lièvre, un mâle et deux femelles, le 13 fév (... voir la suite)",1,52,1,1262,2622,Chatons abyssins disponibles,Paulhac 31380,,,
849,2019-12-02 17:10:46,2019-12-02 17:10:46,"A réserver 2 mâles et 3 femelles Chartreux nés le 14 fevrier 2020 d'une portée de 5 chatons, ils seront pucés, vaccinés avec le rappel et déclarés au (... voir la suite)",1,11,1,798,4952,A reserver chatons chartreux,Chantepie 35135,,,
850,2019-06-10 05:28:34,2019-06-10 05:28:34,"1ère portée de GIC FABSKORATS Oki avec notre jeune mâle Clouseau. 5 chatons sont nés, la croissance est très bonne les chatons ont pris le meilleur d (... voir la suite)",1,32,1,988,6566,Portée de chatons korat a adopter,Saint-maur-des-fossés 94210,,,
851,2019-03-16 03:18:44,2019-03-16 03:18:44,"Disponible à l'Élevage Du Mas De La Hillane ( situé dans le Gers ) , dernière femelle Bouvier Bernois LOF née le 01 Janvier . Maman tatouée 133PAN ( (... voir la suite)",1,30,1,541,2668,"Dernière femelle bouvier bernois lof,paiement 4x",Callian 32190,,,
852,2019-02-27 07:22:16,2019-02-27 07:22:16,"La Chatterie Diamonds vous présente le mariage de Diamonds Odyssée et Osirisbengal Oslo, 6 chatons sont nés le 11 février. Il y a deux chatons de disp (... voir la suite)",1,40,1,1843,4483,Bengal loof,es Pavillons-sous-bois 93320,,,
853,2019-09-20 03:41:20,2019-09-20 03:41:20,Magnifiques chiots BEAGLES LOF . Nés le 09/02/2020. Reste 3 mâles disponibles. Les chiots sont issus du mariage de Mascotte des Molières D'amon (... voir la suite),1,43,1,1815,2055,Magnifiques chiots beagles lof,Chauvigny-du-perche 41270,,,
854,2019-10-07 17:51:32,2019-10-07 17:51:32,"Une magnifique Minette est disponible. Elle s’appelle Lea , elle cherche sa nouvelle famille pour la vie . Elle est Black golden tabby ticked .avec (... voir la suite)",1,21,1,582,2761,Chaton d’apparence british shorthair,Non L.O.O.F.Dombasle-sur-meurthe 54110,,,
855,2019-06-21 12:48:18,2019-06-21 12:48:18,"magnifiques chiots berger belge malinois, lignée 100% utilisation. Chiots inscrits au Lof, Pucés, Vaccinés, Vermifugés, Titulaire d’un certificat (... voir la suite)",1,38,1,236,6774,Chiots berger belge malinois femelle,Saint-benoît-la-forêt 37500,,,
856,2019-01-22 04:31:43,2019-01-22 04:31:43,"Qoconut vient de fêter ses 8 mois. C'est une chatte magnifique avec un caractère exceptionnel, et elle devait rester à la chatterie. Qoconut a été en (... voir la suite)",1,48,1,310,7425,Qoconut cherche une famille pour la vie,Saint-sébastien-sur-loire 44230,,,
857,2019-09-14 12:32:02,2019-09-14 12:32:02,nés le 17/02/2020 du croisement de Lovely de staffy good choice et Nano de l'arche de Caux Sur une portée de 3 femelles et 1 mâle reste disponible à (... voir la suite),1,44,1,1261,4947,A réserver chiot apparence staffordshire bull terrier,Non L.O.F.Lavelanet 09300,,,
858,2019-10-05 04:39:32,2019-10-05 04:39:32,Elevage familial 'Des perles noires de beaumé' vous propose de magnifiques chiots Bullmastiff nés le 23 Janvier à réserver: Mère visible à la maiso (... voir la suite),1,8,1,1477,7213,Chiot bullmastiff lof,Belligné 44370,,,
859,2019-02-06 07:41:22,2019-02-06 07:41:22,". 8 magnifiques chiots sont nés le 31.01.2020. Prix d'un chiot : 1450€. Petit élevage familial, Parents de 'pure race' de très belles lignée (... voir la suite)",1,14,1,1886,4211,Naissances de 8 chiots (lof) le 31 janvier 2020.,Mormant 77720,,,
860,2019-02-16 18:52:19,2019-02-16 18:52:19,"A réserver 13 chiots beaucerons noirs et feu et arlequins nés le 19 janvier 2020 , ils seront pucés, vaccinés et vermifugés , ils sont élevés en famil (... voir la suite)",1,29,1,1181,3782,Chiots beaucerons noirs et feu et arlequins,Camarade 09290,,,
861,2019-09-21 03:25:38,2019-09-21 03:25:38,"chiots leonberg inscrit au lof nés le 23 fevrier 2020 ils seront disponibles fin avril 2020 parents testes dysplasie, de tras bon caractère soci (... voir la suite)",1,28,1,819,6460,Chiot leonberg lof,Moitron-sur-sarthe 72170,,,
862,2019-07-03 02:40:34,2019-07-03 02:40:34,chiots jack russell une portée née le 11/01/20 tricolore une autre blanc et fauve née le 12/02/20 trois males a reserver les chiots sont tous lof puc (... voir la suite),1,34,1,1634,3959,Chiots jack russell,huis 01680,,,
863,2019-12-27 02:31:06,2019-12-27 02:31:06,"A réserver Percy un magnifique mâle spitz nain typé pomeranian né le 25 décembre 2019. Il est élevé en famille. Il a un super caractère, il est t (... voir la suite)",1,21,1,1704,5206,A réserver magnifique mâle spitz nain pomeranian,Bilieu 38850,,,
864,2019-09-09 20:20:07,2019-09-09 20:20:07,Nos 14 petits bouts sont issus d une lignée exceptionnelle de champions internationaux. Ils sont élevés en famille afin de bien les sociabiliser et (... voir la suite),1,52,1,1208,2041,Chiots rhodésian ridgback lignée exceptionnelle,Blot-l'eglise 63440,,,
865,2019-02-05 23:46:04,2019-02-05 23:46:04,"Bonjour, on cherche une gentille famille pour Polly, black silver blotched tabby, douce et câline femelle Main Coon LOOF. Polly a malformation a l (... voir la suite)",1,42,1,426,4694,"Polly, femelle main coon",a Richardais 35780,,,
866,2019-05-30 22:35:15,2019-05-30 22:35:15,A réserver Chiots beagle LOF nés le 21/02/2020 1 Mâle et 3 Femelles. Mère : Ozzie de l'écho du Touat.. Père : Otcho de l'écho du Touat..Excellent (... voir la suite),1,32,1,1142,2030,Chiots beagle lof,Pignan 34570,,,
867,2019-11-01 14:30:31,2019-11-01 14:30:31,"A réserver chiot Akita-Inu, 2 mâles et 1 femelle roux/blanc à poils longs. Issue du père importé du Japon, primé en expositions canines et la mère né (... voir la suite)",1,27,1,609,6422,Chiot akita-inu- mâle et femelle roux et blanc à poils longs,Jettingen 68130,,,
868,2019-02-19 22:30:20,2019-02-19 22:30:20,"L'Sarasa Go of Ikenohatade et Tomokaze Go Shirai (importé du japon) vous annoncent la naissance de leurs chiots pour fin février, il est fortement con (... voir la suite)",1,15,1,431,4962,A vendre chiots akita inu roux et blanc lof,Jettingen 68130,,,
869,2019-07-01 15:57:32,2019-07-01 15:57:32,"2 adorables chiots mâles Labradors noirs d'excellentes origines sont disponibles avec primo-vaccination CHPPIL, identifiés par puce, vermifugés, leur (... voir la suite)",1,10,1,549,2214,Adorables chiots labradors noirs disponibles,Simiane-la-rotonde 04150,,,
870,2019-05-17 00:50:00,2019-05-17 00:50:00,"Adorable chiot mâle Labrador noir d'excellentes origines disponible avec primo-vaccination CHPPIL, identifié par puce, vermifugé, certificat vétérinai (... voir la suite)",1,2,1,300,6501,Adorable chiot labrador noir disponible,Simiane-la-rotonde 04150,,,
871,2019-10-20 04:48:32,2019-10-20 04:48:32,a vendres bébés léonberg pour 4 mâles 5 filles qui sont LOF puce vaccin certificat de santé :ils sont élevés en familles avec enfants chiens et chats (... voir la suite),1,17,1,1145,6485,Bébés léonberg,Vendresse-beaulne 02160,,,
872,2019-10-31 06:32:56,2019-10-31 06:32:56,Maïkan Katchanga of Edelweiss Forever et Manithil Forever of Greystone Shadow sont heureux de vous annoncer la naissance de leurs 8 bébés : 5 mâles et (... voir la suite),1,32,1,689,3358,Chiots à réserver,Eblange 57220,,,
873,2019-07-24 02:58:46,2019-07-24 02:58:46,"Portée de 5 chiots Scottish terriers née le 19 février 2020 : 1 mâle noir, 1 femelle noire, 3 femelles froments. Inscrits au LOF, de très bonnes origi (... voir la suite)",1,12,1,642,4454,Très beaux chiots scottish terrier à réserver,Saint-germain-du-bois 71330,,,
874,2019-03-09 13:43:13,2019-03-09 13:43:13,à réserver 1 Superbe Chiot male et une Magnifique fille crème inscrits au LOF nés le 22 Dec 2019 de couleur crème très clair uni sans coloration ta (... voir la suite),1,55,1,715,2479,Chiot femelle et male chihuahua inscrit au l.o.f,Tourcoing 59200,,,
875,2019-07-27 17:23:59,2019-07-27 17:23:59,"********Il n'est pas a vendre tarif de la saillie 300€ ******** CH Monster Blue Des Ours Gris, mâle blue fawn LOF disponible en saillie, dentition (... voir la suite)",1,21,1,148,3294,Saillie chihuahua poils long lof champion coté4 bleu,Saint-etienne 42000,,,
876,2019-06-02 06:32:52,2019-06-02 06:32:52,Je recherche une famille pour SOLAL un mâle ADULTE DE RACE BENGAL âgé de moins de 3 ans (née le 06/05/2017) et castré. Couleur brown rosetted tabby. (... voir la suite),1,3,1,158,2298,Male bengal adulte 3 ans castre,Chassenard 03510,,,
877,2019-06-17 03:55:30,2019-06-17 03:55:30,Elevage familial de Maine Coon dans le Sud de la France. Monamour femelle bleue smoke a donné naissance à 6 chatons le 2 février 2020. Les chatons s (... voir la suite),1,38,1,1399,7665,Mâle maine coon black smoke et blanc,Nice 06200,,,
878,2019-10-14 21:54:54,2019-10-14 21:54:54,Elevage familial de Maine Coon dans le Sud de la France. Monamour femelle bleue smoke a donné naissance à 6 chatons le 2 février 2020. Les chatons s (... voir la suite),1,3,1,630,5043,Femelle maine coon black smoke et blanche,Nice 06200,,,
879,2019-04-23 22:21:49,2019-04-23 22:21:49,Elevage familial de Maine Coon dans le Sud de la France. Monamour femelle bleue smoke a donné naissance à 6 chatons le 2 février 2020. Les chatons s (... voir la suite),1,34,1,449,5136,Mâle maine coon noir,Nice 06200,,,
880,2019-01-12 23:43:51,2019-01-12 23:43:51,"Superbes chiots Spitz LOF 3 mâles à réserver couleur orange, orange charbonné Ils partiront vaccinés, identifiés par puce électronique inscrits (... voir la suite)",1,33,1,1755,4444,Superbes chiots spitz lof,Sommecaise 89110,,,
881,2019-03-23 11:33:49,2019-03-23 11:33:49,"Superbes chiots Chihuahua LOF poil court 2 mois, seront disponibles début mars mâles et femelle (mini gabarit qui partira de l'élevage qu'à ses 3 vo (... voir la suite)",1,9,1,1963,5313,Superbes chiots chihuahua lof mini,Sommecaise 89110,,,
883,2019-06-23 13:07:29,2019-06-23 13:07:29,Une très belle portée de 6 chiots bichons havanais nés le 15 février 2020. Issus de parents lofés et primés . La maman Nessika du domaine de Brièr (... voir la suite),1,49,1,1971,3735,Très belle portée de bichons havanais,Sausset-les-pins 13960,,,
884,2019-08-12 19:38:58,2019-08-12 19:38:58,Vends joli chiot spitz nain N 1-2-3- 4-5-6-7-8-9 Pooky N 10-11-12-13-Paden Le Maman 14-15 Le Papa 16 (... voir la suite),1,12,1,423,6120,Spitz nain,Sion-les-mines 44590,,,
885,2019-09-14 05:08:41,2019-09-14 05:08:41,"La chatterie Des Neiges d’Iroise vous propose à la réservation 1 chaton Maine Coon : 1 femelle blue silver mackerel tabby (réservée), 1 mâle brown (... voir la suite)",1,46,1,702,6732,Chaton à réserver,Eaubonne 95600,,,
886,2019-07-11 07:18:48,2019-07-11 07:18:48,Bonjour Les bébés de Queen sont nés 2 garçons et 2 filles !! Très équilibrés comme portée. 1 fille est déjà réservée. Nous élevons par amour de (... voir la suite),1,31,1,1991,3995,Liste de réservation ouverte,Pluméliau 56930,,,
887,2019-04-28 03:09:49,2019-04-28 03:09:49,"Petit Prince, né le 18 octobre, il y a donc 4 mois, est un adorable bouli LOF, de couleur caille, qui attend sa famille. Il est identifié, inscrit (... voir la suite)",1,14,1,245,6998,Chiot bouledogue français lof,a Geneytouse 87400,,,
888,2019-06-26 23:10:51,2019-06-26 23:10:51,"Rainbow, et Royal, sublimes mâles Chihuahua LOF de variété poil long de couleur lavande nés le 16 janvier 2020. Disponibles à partir du 20 mars 2020. (... voir la suite)",1,24,1,1123,2376,Sublimes chiots chihuahua poil long couleur lavande lof,Houdan 78550,,,
889,2019-08-16 02:24:25,2019-08-16 02:24:25,"Véritable Spitz Poméranien nain chocolat LOF au caractère très affectueux et joueur, très très belle conformité, grosse ossature, très grosse fourrure (... voir la suite)",1,26,1,630,7905,Mâle spitz nain pomeranien chocolat,Houdan 78550,,,
890,2019-03-30 16:21:56,2019-03-30 16:21:56,Pigalle de l'Hortensia Bleu Chatons mâle chartreux disponible il est primo vacciné et rappel fait identifié à l'ICAD et au LOOF passeport (... voir la suite),1,53,1,1077,5457,Chatons chartreux loof,Douai 59500,,,
891,2019-05-08 07:52:08,2019-05-08 07:52:08,BEBES COTONS DE TULEAR BLANCS DE GRANDE QUALITE ATTENDUS DEBUT AVRIL 2020. Deux portées cotées 8 étoiles sont attendues à l'élevage du Castel de la (... voir la suite),1,1,1,1214,5257,Cotons du castel de la roche aux fées,Pancé 35320,,,
892,2019-03-05 10:48:00,2019-03-05 10:48:00,"La Chatterie Of British Archanges vous présente ses chatons British Shorthair ( seront LOOF). Nés le 18/02/2020 d’Operette blanche, Femelle British (... voir la suite)",1,33,1,1040,5566,A réserver somptueux british shorthairloof,Château-du-loir 72500,,,
893,2019-12-12 18:35:43,2019-12-12 18:35:43,"Chiot à réserver sur la portée de (MCH) Maggie May de l'Aige de la Tournelle et (CH) Oscar du Bois des Ternes, ils sont nés le 17 Février 5 Mâles et 2 (... voir la suite)",1,35,1,787,2995,Chiot berger blanc suisse,Minot 21510,,,
894,2019-05-14 01:56:49,2019-05-14 01:56:49,"A Béziers, dans mon petit élevage, Le Clan des Majebaas, sont nés le 20 janvier 2020 1 mâle lièvre et 1 femelle sorrel. Ils sont nés dans ma chambr (... voir la suite)",1,56,1,150,7580,Chaton abyssin mâle à réserver,Béziers 34500,,,
895,2019-05-08 12:06:29,2019-05-08 12:06:29,A réserver sublimes chatons british shorthair bleus et lilas nés le 17/03/2020 : Ryana et Rosita : femelles bleues Riley : mâle bleu Rhum-coco et R (... voir la suite),1,24,1,447,5429,"Chatons british shorhair pedigree, livraison possible",Manosque 04100,,,
896,2019-12-01 18:52:57,2019-12-01 18:52:57,"Memphis, Mâle de couleur silver, presque 5 ans, est un chat très gentil, bavard et câlins. Il est maintenant à la retraite et je voudrais lui trou (... voir la suite)",1,11,1,1518,3792,"Memphis, mau egyptien silver",a Geneytouse 87400,,,
897,2019-09-14 00:58:00,2019-09-14 00:58:00,"Mélody est une chouette bulldog, très sympa, jolie,, toujours contente. Elle est super mais n'est pas faite pour l'élevage. Je la cède à contre co (... voir la suite)",1,51,1,1475,4014,A vendre femelle bulldog anglais,a Geneytouse 87400,,,
898,2019-09-03 01:08:20,2019-09-03 01:08:20,Musique de la Source du Riet Veld et Oz de la Source du Riet Veld issus d'une lignée de champions de beauté sont heureux de vous annoncer l'arrivée (... voir la suite),1,34,1,1217,7603,Chiots golden retriever très clairs nés le 11 février 2020 à réserver,Zermezeele 59670,,,
899,2019-09-14 08:51:14,2019-09-14 08:51:14,Elevage familial de sphynx proche de Toulouse. Macbeth sphynx mania's et Baloo ont donné naissance à 3 petits sphynx ! REPETTO mâle noir REGATTA (... voir la suite),1,52,1,1101,3792,Sphynx disponible loof,Cahors 46000,,,
900,2019-10-15 15:33:20,2019-10-15 15:33:20,Chiots à réserver sur une portée de 9 (4 mâles et 5 femelles) nés le 17 février 2020 issus du mariage de : - N'JOAO NEELAH DU BATAILLON DE CHARME fem (... voir la suite),1,30,1,1487,7653,Superbes chiots golden retriever lof,anouaille 24270,,,
901,2019-09-18 03:55:50,2019-09-18 03:55:50,Chiots à réserver sur une portée de 10 (5 mâles et 5 femelles) nés le 21 février 2020 issus du mariage de : - JILIN SWEET ANGEL DES JARDINS D'OR ET D (... voir la suite),1,49,1,1609,2781,Superbes chiots golden retriever lof,anouaille 24270,,,
902,2019-01-09 03:15:56,2019-01-09 03:15:56,Bonjour l'elev age des pattes D'argent sont heureuses de vous apprendre la naissance de 3 petit Male Cavalier King Charles Tricolore Née le 22/01/2 (... voir la suite),1,35,1,612,6698,Magnifique chiots cavalier king charles lof tricolore,Saint-etienne 42000,,,
903,2019-09-07 04:07:41,2019-09-07 04:07:41,"Le beau mois d'Avril , devrait être propice pour la naissance des petits gris nés de l'union de Miss Marley de Gray Ghost' de la Chevalerie et du be (... voir la suite)",1,3,1,929,2085,Miss marley et maurin,Saint-georges-du-vièvre 27450,,,
904,2019-11-28 22:24:12,2019-11-28 22:24:12,"Lucy du chemin des puits tournants vient de nous donner une tres belle portee de 10 bebes ,tous tres homogenes plus 3 petits males cailles fauves i (... voir la suite)",1,32,1,111,2121,Tres belle portee de bouledogue français,Marieux 80560,,,
905,2019-01-30 04:33:34,2019-01-30 04:33:34,"Vends chiots Border terrier disponible à partir de 10 semaines, vermifugés tous les 15 jours jusque l'âge de 2 mois, vaccinés et pucés, vendu avec cer (... voir la suite)",1,2,1,1167,5341,Vend chiots border terrier,ontaine-l'etalon 62390,,,
906,2019-08-10 01:16:37,2019-08-10 01:16:37,Une jolie portée vient de voir le jour. Excellentes origines américaines Parents testés et radiographiés Les resultats des examens sont donné (... voir la suite),1,15,1,322,4387,Magnifiques chiots bergers americains miniatures,Grez-neuville 49220,,,
907,2019-05-07 08:30:34,2019-05-07 08:30:34,chatons Maine Coon nés le 17/12/2019 ils seront disponibles le 14/03/2020 prix 1.000e il a 3 Males Noir et une femelle Black Silver (... voir la suite),1,22,1,1096,5970,Chatons à réserver,Vaires-sur-marne 77360,,,
908,2019-09-25 20:31:39,2019-09-25 20:31:39,"Une magnifique portée de Yorshire Terrier est née le 4 février, 1 mâle et 4 demoiselles. Il ne reste plus qu'un magnifique mâle et une merveilleuse f (... voir la suite)",1,49,1,1777,2609,Yorkshire terrier lof,Saint-andré-le-gaz 38490,,,
909,2019-03-02 13:39:00,2019-03-02 13:39:00,"L'élevage du Domaine Charlésien vous présente une nouvelle portée de chiots ENGLISH SPRINGER SPANIEL inscrits au LOF: Sur la portée du 18/01/19, i (... voir la suite)",1,16,1,642,4321,A réserver chiots english springer spaniel lof.,Montoire-sur-le-loir 41800,,,
910,2019-11-17 00:39:30,2019-11-17 00:39:30,L'élevage du Domaine Charlésien vous propose à la réservation une portée née le 13/02/2020 de chiots GOLDEN RETRIEVER inscrits au LOF. Les bébés ser (... voir la suite),1,5,1,466,4118,A réserver chiots golden retriever lof.,Montoire-sur-le-loir 41800,,,
911,2019-11-28 23:57:26,2019-11-28 23:57:26,"L'élevage du Domaine Charlésien vous annonce une nouvelle portée de chiots berger blanc suisse inscrits au LOF nés le 21/01/20. Sur cette portée, il r (... voir la suite)",1,9,1,749,5544,A réserver chiots berger blanc suisse inscrits au lof. parents testés.,Artins 41800,,,
912,2019-07-27 06:57:00,2019-07-27 06:57:00,"Une portée de 9 chiots est née le 18 février 2020. Il y a 8 femelles et 1 mâle. 4 femelles et le mâle sont déjà réservés, 2 dans le coin, 1 à Tarbes, (... voir la suite)",1,58,1,1716,4649,4 chiots femelles patous ou montagne des pyrénées,Saint-castin 64160,,,
913,2019-05-04 08:41:18,2019-05-04 08:41:18,"American Curl, nés le 8 août 2019, disponibles immédiatement Ils partiront vaccinés, pucés, inscrits au loof. Les parents sont visibles à la chatter (... voir la suite)",1,48,1,1673,6303,Chatons american curl,Nébouzat 63210,,,
914,2019-03-12 21:40:36,2019-03-12 21:40:36,"American Curl, nés le 14 juin 2019, disponibles immédiatement Ils partiront vaccinés, pucés, inscrits au loof. Les parents sont visibles à la chatte (... voir la suite)",1,22,1,1171,5518,Chatons american curl,Nébouzat 63210,,,
915,2019-05-14 09:21:47,2019-05-14 09:21:47,"A réserver 8 chiots de race drahthaar 2 mâles dont 1marron et blanc et 1 noir et blanc et 6 femelles 4 noir et blanc , 2 marron et blanc d’une portée (... voir la suite)",1,3,1,1611,5357,8 chiots de race drahthaar,Chevillard 01430,,,
916,2019-11-17 22:27:04,2019-11-17 22:27:04,"Pretty, femelle, noire, 1200€ Elle est vaccinée, pucée, vermifugée, et inscrite au LOF. Elle est affectueuse, joueuse, dynamique, et très proche des (... voir la suite)",1,13,1,8,5066,Chiots carlin,Nébouzat 63210,,,
917,2019-01-05 07:47:09,2019-01-05 07:47:09,Harry du domaine de l'érisse (LOF 664893/41746) et G'Sangha des terres quileute (LOF 653369/60230) sont heureux de vous annoncer la naissance le 19/02 (... voir la suite),1,52,1,887,2947,Splendides chiots bergers allemands inscrits au lof,Marennes 17320,,,
918,2019-08-20 14:18:43,2019-08-20 14:18:43,Hawaï beach des princes des cévennes (LOF 108875/13565) et Ouragan du puits des sortilèges (LOF 152643/25493) sont heureux de vous annoncer la naissan (... voir la suite),1,28,1,639,7624,Splendides chiots cavaliers king charles inscrits au lof,Marennes 17320,,,
919,2019-12-08 17:54:30,2019-12-08 17:54:30,"En Bourgogne 3 Chiots Westie sont nés le 24 janvier 2020 . Ils seront , vermifugés , vaccinés CHPL et identifiés par puce électronique . Ils se (... voir la suite)",1,39,1,548,6318,"En bourgogne , chiots westie à réserver",Autun 71400,,,
920,2019-05-27 20:36:44,2019-05-27 20:36:44,« Marzacknoll » Memphis d’origine américaine Grand Champion d’Europe et Néfertiti « Du fort de la bosse marnière » Championne d'Europe sont les paren (... voir la suite),1,27,1,1812,6200,Chatons maus egyptiens black silver spotted tabby inscrits au loof,Marennes 17320,,,
921,2019-11-13 09:30:54,2019-11-13 09:30:54,Très belle portée de chiots jack Russel terrier poils durs origine australienne LOF. Ils sont nés le 22 janvier 2020. N'hésitez pas à visiter le site (... voir la suite),1,50,1,1077,2826,Chiots jack russel terrier origine australienne,ugos 33830,,,
923,2019-02-15 20:23:00,2019-02-15 20:23:00,"Très beau chaton norvégien mâle, né le 28 janvier 2020 est disponible à la réservation. Robe : roux smoke. Nos chatons quittent la maison à l’âge de (... voir la suite)",1,10,1,1005,6732,Chaton norvégien à réserver,e Versoud 38420,,,
924,2019-12-07 03:23:39,2019-12-07 03:23:39,"Femelle née,élevée et sevrée à la maison, sera habituée aux enfants bruits du quotidien, ballade, chats marche en laisse Primo vaccinée vermifugée av (... voir la suite)",1,51,1,1892,3593,Femelle poils longs,Beauzac 43590,,,
925,2019-07-12 09:28:38,2019-07-12 09:28:38,"Peace and Plenty, élevage familial de Golden depuis plus de 20 ans vous propose de réserver votre futur chiot golden retriever né le 22 mars 2020 (d (... voir la suite)",1,49,1,1734,6528,Chiots golden retriever lof à réserver pour mi mai,Verdelot 77510,,,
926,2019-11-11 04:16:16,2019-11-11 04:16:16,"Né le 13 février 2020, portée inscrite au LOF, les bébés partiront pucés, vaccinés, vermifugés, avec kit chiot et doudou. Numéro de portée : 20200056 (... voir la suite)",1,14,1,1400,5722,A réserver chiot mâle leonberg,Ambutrix 01500,,,
927,2019-06-02 22:09:06,2019-06-02 22:09:06,Jolis chiots issus d'un mariage accidentel de deux caniches LOF de couleurs différentes. Parents visibles et ayant déjà reproduit des chiots LOF sépar (... voir la suite),1,7,1,141,6928,Apparence caniches nains gris,Non L.O.F.Bruyères-le-châtel 91680,,,
928,2019-07-23 18:59:46,2019-07-23 18:59:46,sergent chef love a eue 5 magnifiques bébés qui sont maintenant disponible 1 mâle fauve 1 femelle caille fauve 2 fauve les bébés sont de tous petit (... voir la suite),1,55,1,1654,5005,Bouledogue français lof,Parisot 82160,,,
929,2019-01-08 12:31:24,2019-01-08 12:31:24,"Bonjour ! 3 femelles ..parfait , et un mâle !!! trop joli... vous avez le choix !!! 0325296759 pour plus de renseignements où votre visite pour vo (... voir la suite)",1,7,1,1136,6507,0325296759 pour cette très jolie portée,Virey-sous-bar 10260,,,
